{
  "task_id": "eval-02",
  "turn_index": 5,
  "current_state": "RESEARCH",
  "workflow_mode": "multi-agent-full",
  "risk_level": "L4",
  "active_roles": ["pipeline", "explorer", "planner"],
  "admission_decision_log": [
    "问题涉及最佳实践与最新资料",
    "必须执行联网研究"
  ],
  "last_updated": "2026-03-07T10:15:00+08:00"
}
