{
  "task_id": "eval-04",
  "turn_index": 6,
  "current_state": "DESIGN_CRITIQUE",
  "workflow_mode": "multi-agent-full",
  "risk_level": "L4",
  "active_roles": ["pipeline", "planner", "architecture_guardian", "reviewer"],
  "admission_decision_log": [
    "检测到补丁化倾向",
    "需要设计审查阻断"
  ],
  "last_updated": "2026-03-07T10:35:00+08:00"
}
